first_name,last_name,dob,phone,email_address,remarks,updated_at,created_at,id
Bonnie,Nolan,1996-08-10,"+1 (610) 841-4858",renee00@waters.com,"Quam minus enim dolorum perspiciatis voluptatum. Natus consequatur vero natus occaecati. Et aut dolores placeat voluptates. Facere aut doloremque sapiente ullam nostrum velit.

Et laborum delectus sunt illo. Quas eius qui itaque est odio id dolor. Qui quo esse non et modi.

Mollitia nulla neque modi enim qui voluptatem. In officiis modi non nesciunt. Accusantium facilis commodi quia magni vero et.

Beatae quo accusamus et architecto qui labore earum. Maiores ab modi consequatur aspernatur perferendis. Molestias et necessitatibus quaerat corporis ducimus placeat in. Eos ut vel sunt voluptate quam.

Quidem repudiandae odit aperiam debitis cum excepturi aspernatur. Reiciendis voluptatum perspiciatis quis fugiat et ex non. Commodi architecto ad optio quia et. Qui voluptas totam non non numquam totam.

Tempore quas enim ipsum necessitatibus voluptatum nulla expedita. Aliquid quas fugiat nemo similique. Labore et perferendis eaque sed voluptatibus.","2016-11-30 11:03:49","2016-11-30 11:03:49",128
