first_name,last_name,dob,phone,email_address,remarks,updated_at,created_at,id
Ressie,Langosh,1974-03-21,"524.967.1576 x103",matt82@gmail.com,"Accusamus rerum cum ut ullam qui tempore. Minus sapiente velit quia voluptatem quae. Velit itaque iusto aliquid aliquam possimus sunt.

Enim sunt hic rem eius at. Numquam est non asperiores accusantium eligendi. Enim omnis sed ut minima placeat et.

Et voluptates aspernatur voluptatem officiis et cupiditate. Facere nobis sed et sed voluptas fuga. Explicabo esse similique suscipit sunt autem et aut. Ut modi vitae provident incidunt.

Repudiandae aut ex molestiae ut libero. Alias porro inventore consequatur. Id deleniti repellat voluptas officia. Aut suscipit aliquam repudiandae quas voluptates iure.

Reprehenderit ducimus voluptas explicabo. Amet eum suscipit eligendi cumque ut quod maiores. Voluptas veniam eum porro. Eius sit qui laborum tempore.

Atque corrupti ab quasi voluptates. Repellendus autem laboriosam illum quaerat dolore assumenda. Saepe quia cum consequatur tenetur in consequuntur. Aut ut tempora quis non eveniet libero.","2016-11-30 11:03:50","2016-11-30 11:03:50",140
