first_name,last_name,dob,phone,email_address,remarks,updated_at,created_at,id
Alfredo,Turner,2013-06-26,"338-636-4107 x678",mmann@gmail.com,"Amet ipsum ut libero mollitia qui optio. Doloremque molestiae pariatur amet sit. Enim ut quia omnis hic.

Quis possimus at quia non quo. Asperiores temporibus quo provident et.

Aspernatur ut fugit cumque sint veniam. Voluptatum rerum enim qui vero. Voluptatem iste laborum quo qui quos aut nihil et.

Et veritatis aliquam sint ut rerum cupiditate corporis. Et culpa itaque autem amet. Perspiciatis et adipisci culpa sed.

Vel atque id aliquam laborum. Aliquid neque laudantium numquam voluptatem in delectus. Enim itaque odit enim numquam error cum. Officiis odio sit soluta fugit odit omnis natus commodi.

Asperiores repudiandae a qui aut nulla quasi sit occaecati. Earum fuga et ut optio itaque illo. Itaque id enim voluptas quis est.","2016-11-30 11:03:50","2016-11-30 11:03:50",149
