first_name,last_name,dob,phone,email_address,remarks,updated_at,created_at,id
Josie,Green,1978-06-21,"215-673-7994 x210",roscoe.homenick@hotmail.com,"Dolores explicabo nesciunt sapiente sed earum. Omnis vel aspernatur fuga asperiores aliquam. Dolorum odio dolorem repudiandae qui libero et perferendis. Pariatur ad rem qui quia.

Ab minima consequuntur ea saepe. Aut ullam neque neque. Animi mollitia quo fugit aut et autem. Consectetur ipsa doloribus aliquam minus maxime.

Qui vero ut saepe vitae. Est laudantium cum ut amet rem magni pariatur iure. Velit id dolores cum. Itaque ipsum laboriosam nemo sed quidem laborum.

Qui voluptas porro ex ut et. Corrupti voluptatum enim perferendis corrupti ut voluptates. Quia numquam quia asperiores et. Distinctio et qui ullam error.

Vel et et quis reprehenderit suscipit error harum. Eius nulla et molestiae omnis esse. Porro totam beatae nihil neque perferendis.

Exercitationem nam corporis dolores earum ad. Quia aut voluptatem et ipsum repellat ducimus vitae. Laborum dignissimos sit similique vel ut molestias sunt.","2016-11-30 11:03:45","2016-11-30 11:03:45",15
