first_name,last_name,dob,phone,email_address,remarks,updated_at,created_at,id
Daphnee,Bechtelar,1994-01-04,+12952904370,kathryn08@davis.com,"Architecto autem eius soluta. Consequatur qui consectetur nemo quia. Reprehenderit dolores est esse.

Autem esse consequatur accusamus beatae ut similique cumque deserunt. Unde nisi doloribus facilis maxime. Vel cupiditate animi vero aliquid accusamus voluptas et.

Tenetur dolor non quos qui sint rerum et. Nisi illum quia quam excepturi ut sapiente laboriosam perspiciatis. Occaecati nisi dolore quo placeat.

Illum rerum possimus fugiat et quae qui ea vitae. Sed nisi eum eveniet aut quia sunt ea. Molestiae in quia omnis autem iure.

Aperiam perspiciatis voluptatum voluptas dolore. Aliquam tempora libero sit sed omnis vero. Iure voluptatem magni nihil et quas. Quos officiis reiciendis temporibus esse.

Natus et nemo eius neque deleniti non. Et aliquid tempore sapiente. Quis ab adipisci fuga dignissimos at. Qui eum rerum et error officia cumque.","2016-11-30 11:03:50","2016-11-30 11:03:50",154
