first_name,last_name,dob,phone,email_address,remarks,updated_at,created_at,id
Durward,Ward,1975-12-19,"1-862-491-5176 x82228",nmorar@harvey.com,"Velit et rerum qui voluptatem. Facere porro et veritatis voluptas nesciunt.

Omnis ullam optio sunt illo dolor quo voluptatem. Sint voluptas impedit illum inventore. Labore vel nemo sunt cupiditate sit impedit sed. Possimus perspiciatis exercitationem et commodi.

Numquam qui soluta blanditiis vel mollitia quisquam. Sed iusto eum ut quis consequatur voluptas velit. Pariatur omnis sed voluptatem adipisci laborum aut.

Harum fugit quibusdam maxime qui unde. Id et porro in ut sunt. Quaerat eveniet error amet illum et labore. Animi rem rem eum.

Earum cum aut placeat eligendi et inventore. Sit eum et praesentium odit. Enim laudantium aspernatur deleniti aut cupiditate ipsum. Inventore ipsum doloremque reprehenderit.

Ratione dolore dolor quam ea pariatur. Ut voluptatem illo nobis expedita. Vel dolorum velit eum animi. Cupiditate nostrum excepturi et ipsam sed delectus. Facilis dignissimos repellendus deserunt aut et quisquam.","2016-11-30 11:03:45","2016-11-30 11:03:45",17
