first_name,last_name,dob,phone,email_address,remarks,updated_at,created_at,id
Israel,Wisoky,2006-08-10,+1.741.593.0699,shania.balistreri@davis.net,"At et aut enim occaecati id et. Ab magnam voluptatem dolorem dolores atque suscipit. Quaerat ut voluptas delectus.

Soluta dolor et sunt corrupti ut dolore quisquam. Excepturi maxime vel vel saepe. Ab omnis placeat placeat voluptatibus tenetur.

Accusamus aliquid cupiditate earum debitis. Officia explicabo ut dolores esse voluptatem corrupti.

Soluta quasi fuga perspiciatis at quia. Quia corporis quisquam magni veritatis minus. Voluptas laudantium rem molestiae quaerat facilis repellat. Sed optio nam mollitia quia fugit maiores aut ad. Rerum aut velit alias repellendus.

Beatae amet occaecati tempora. Aperiam ut maxime non. Et labore sed sunt sit consequatur totam sapiente.

Ipsum rerum explicabo nulla et. Aliquid quo deserunt et voluptatem debitis optio. Molestiae deserunt fuga est iste tempore.","2016-11-30 11:03:51","2016-11-30 11:03:51",187
