first_name,last_name,dob,phone,email_address,remarks,updated_at,created_at,id
Amie,Block,1997-10-31,"237-862-0362 x808",mireille54@gmail.com,"Sit ut laboriosam distinctio qui et rerum. Voluptas voluptatem culpa et corporis sapiente. Ullam explicabo nemo similique. Earum itaque et eos.

Nihil fugiat sit aut magnam consequatur. Harum sint dolor iure ea dicta culpa doloremque. Fugit eveniet deserunt beatae non dolor fugit quisquam. Quo quo porro mollitia impedit in quo eveniet molestiae. Animi laudantium similique iure quis voluptas.

Omnis nostrum iure neque ipsum voluptate facilis expedita. Quo sint amet ratione. Porro id et voluptatum quas ut beatae. Quasi sint nulla ut.

Omnis rerum sed omnis velit sed debitis ex. Enim nobis quaerat nemo eaque eum. Qui fugit assumenda voluptatibus aspernatur quasi.

Rem et voluptas voluptatum mollitia quis. Aliquam iure aliquid itaque et. Assumenda modi sit fuga ut fuga.

Dolorem laudantium unde rerum officiis esse quis. Eum laboriosam ad rerum animi sed. Dolores aut quas occaecati.","2016-11-30 11:03:52","2016-11-30 11:03:52",198
