first_name,last_name,dob,phone,email_address,remarks,updated_at,created_at,id
Kamren,Nicolas,1993-07-19,"1-827-429-2292 x0726",stephan07@yahoo.com,"Qui atque cupiditate facilis est magni aut. Voluptas aut dolore ut culpa dolorem a rerum. Ut est aperiam illo et culpa ducimus est.

Ut expedita ad eligendi. In eveniet veniam eos ut architecto unde qui. Qui deserunt omnis explicabo quidem doloribus architecto. Iste sed provident dolorem non harum accusantium consectetur.

Accusamus aut facilis aperiam voluptas sit eaque velit. Sed impedit temporibus ut sit dolorum qui. Accusantium ut voluptatem accusantium ex totam voluptatibus fuga et.

Autem quis porro aliquid ratione atque culpa fuga. Perspiciatis quibusdam quae sunt necessitatibus. Tempore omnis ut eos nisi eos voluptatem ut aperiam.

Reiciendis vel magnam dignissimos et ratione. Officiis nulla minus rerum explicabo qui at. Explicabo ullam omnis quia quia laboriosam atque aspernatur.

Repudiandae asperiores aut tempora nisi. Aspernatur quae natus voluptas vel est sint. Quam consectetur modi minima ipsa. Harum natus nulla omnis ex aut.","2016-11-30 11:03:52","2016-11-30 11:03:52",201
