first_name,last_name,dob,phone,email_address,remarks,updated_at,created_at,id
Lance,Spinka,1995-04-17,"1-993-590-1444 x93222",efrain.effertz@daniel.org,"Odit quo pariatur delectus quod aspernatur quasi. Veritatis aperiam sint deleniti reiciendis qui velit temporibus. Error error quam numquam ducimus nam.

Quae et voluptatem blanditiis ut recusandae. Sit eos sunt est eaque et nobis. Mollitia dolorem dolorem quas et in perferendis error fuga.

Placeat deserunt error beatae qui. Ipsum explicabo id qui voluptatum. Eos tempora quod qui nisi qui sit.

Perferendis est excepturi optio consequatur mollitia tempora ut. Consequatur quo doloremque blanditiis non similique reprehenderit expedita.

Sit sed consequatur tempora dolore in. Est laboriosam enim aperiam atque dolor. Neque consequatur labore et quia ut. Officia deleniti perferendis vel similique.

Expedita eos iure quia velit magni. Est qui totam non adipisci eius sit quas. Aspernatur reprehenderit tempora recusandae cupiditate architecto sequi non harum.","2016-11-30 11:03:52","2016-11-30 11:03:52",205
