first_name,last_name,dob,phone,email_address,remarks,updated_at,created_at,id
Mohammed,Leuschke,1989-12-23,"(798) 831-7769",evans70@kozey.info,"Omnis vel dolores ut velit eligendi delectus iste. Molestiae odit repellendus enim delectus. Sequi nemo animi reprehenderit fugit officia reprehenderit.

Debitis sequi recusandae velit consequuntur. Expedita blanditiis voluptas explicabo repudiandae.

Et facilis deserunt explicabo accusamus pariatur odit ipsa id. Est culpa sit fugiat optio. Reiciendis dolor aut assumenda molestias. Temporibus quas expedita laboriosam molestias aut.

Ut qui eos rerum neque porro fugit hic. Nisi autem dolores eum dolore sed pariatur a fuga.

Voluptas nihil quos nobis placeat placeat ut. Qui autem saepe nisi ut ipsa sed soluta. Labore quis voluptas quia.

Magni eaque vel dignissimos voluptas. Unde impedit minus consequatur magni. Occaecati atque et veritatis dolorem rem et sit.","2016-11-30 11:03:52","2016-11-30 11:03:52",209
