first_name,last_name,dob,phone,email_address,remarks,updated_at,created_at,id
Malinda,Boyer,2012-04-23,"+1 (452) 264-4227",kuhlman.eldora@lakin.com,"Iste voluptas velit nihil rerum aut. Vel et aut ex delectus magni quisquam. A exercitationem dolorum eveniet a. Ea consequatur consectetur quo ipsam quia veniam omnis.

Aliquam soluta unde et doloribus modi quisquam ipsum. Animi impedit id quis optio sed dolorem.

Sint sed iure tempora ad enim unde velit. Aut quia molestias aspernatur voluptas cumque sint. Corporis sed iusto et aliquam ut quo. Atque sed officia iusto qui quia similique commodi exercitationem.

Facere delectus voluptas consequatur magnam sequi voluptates. Repellendus at assumenda tempore perspiciatis nemo ut eius a. Iure odio ad nulla enim dolor modi. Eos esse libero consequatur enim aspernatur. Non voluptate recusandae sit natus.

Omnis quibusdam repellat sunt sint eum minus culpa. Aspernatur quisquam eos architecto veritatis nam. Cum impedit et eos dolorem et.

Aliquam sapiente commodi quaerat inventore. Rerum porro vero vero doloremque. Blanditiis laboriosam maiores quaerat. Aspernatur amet nobis ipsam repellendus.","2016-11-30 11:03:52","2016-11-30 11:03:52",218
