first_name,last_name,dob,phone,email_address,remarks,updated_at,created_at,id
Krystina,Feeney,2009-01-10,"486-690-1588 x907",bryce40@gmail.com,"Cumque aut nobis voluptatem deserunt praesentium quidem. Cumque iusto placeat quam aut sed. Officia laboriosam autem quia vel animi voluptatibus aut. Dolores ut assumenda aspernatur vel labore.

Iste fugit quia ut qui quo non. Saepe sint beatae necessitatibus et dolores reprehenderit. Aliquid fugit voluptatem dolorem nesciunt et.

Eum et maxime quia cum aut. Et autem sit soluta. Quam voluptatem sit molestias voluptatibus dolores et. Voluptates assumenda dolor voluptas alias.

Est nobis iure sunt consectetur. Ipsam esse quaerat officiis modi eligendi ipsa. Incidunt ut voluptatum molestias enim. Hic quam optio voluptas neque nesciunt minima.

Deleniti minima consequatur aut quia. Perferendis autem ad consequatur quibusdam in nesciunt veniam. Distinctio nihil est quo dolor. Accusantium laborum harum libero vitae.

Voluptas inventore pariatur quia tenetur dolores laboriosam qui. Hic possimus eum totam quas rem illo. Non voluptatem maxime repudiandae sint tenetur est. Dolor et ex dicta dolor est quod. Autem atque illo est voluptas eum adipisci.","2016-11-30 11:03:46","2016-11-30 11:03:46",22
