first_name,last_name,dob,phone,email_address,remarks,updated_at,created_at,id
Nicholas,Erdman,1985-08-25,"(607) 746-9775 x91194",ugoodwin@keebler.org,"Veritatis laborum neque assumenda omnis non. Repellat quos aliquam totam dolorem. Aut repudiandae voluptas nisi et. Totam libero exercitationem eveniet impedit et dignissimos et.

Doloribus corrupti vel non officia at. Vel ut ex et et. Non dicta expedita dicta atque repellat nobis sint. A quo et id nesciunt quasi quos repudiandae.

Non nostrum omnis soluta impedit qui. Est aliquam voluptas sint quasi commodi ea. Illum dolores aspernatur ea.

Et molestiae incidunt quos. Placeat soluta nisi sed ut fugiat. Doloremque sed iusto quae et beatae et quia.

Error illo esse et quis animi aut. Perferendis autem ipsum occaecati quasi voluptatem. Quisquam facilis sit vero quo quos est dolorem. Quia et est et est possimus et quo.

Sunt ipsam aut distinctio repellendus odio. Voluptatem nam assumenda id occaecati ea mollitia incidunt. Libero accusantium vel alias laudantium minus consequatur.","2016-11-30 11:03:53","2016-11-30 11:03:53",227
