first_name,last_name,dob,phone,email_address,remarks,updated_at,created_at,id
Abby,Hodkiewicz,2002-02-14,"+1 (485) 843-2838",tkuhn@mayert.biz,"Suscipit eligendi minima sunt molestias. Sit accusamus culpa non. Quam dolore mollitia ipsam quae.

Est eum eos aut modi labore odit illum. Minus atque id doloribus quidem assumenda. Molestiae necessitatibus sunt aut delectus inventore vel eos.

Eius saepe modi alias dolorem. Facere velit pariatur vitae voluptatem minus omnis. Ipsam dolor nihil pariatur est quaerat quibusdam.

Debitis dolores nisi modi. Iusto tempora optio corrupti eum consequatur illo aut. Earum sint ea fuga.

Enim officiis incidunt ut alias quaerat quaerat dicta. Odio deleniti sunt aut facere maxime corporis nostrum. Fugit et iure quia. Et commodi ut dolor aut magni voluptates.

Id possimus beatae voluptatem beatae eligendi. Repudiandae quae sapiente nesciunt reiciendis doloribus. Quas nulla repellendus aut iusto praesentium in nemo.","2016-11-30 11:03:53","2016-11-30 11:03:53",236
