first_name,last_name,dob,phone,email_address,remarks,updated_at,created_at,id
Jerrod,Fay,1972-01-04,"(545) 553-8019",taurean.kris@hotmail.com,"Nisi aut corporis accusamus autem ut distinctio minima. Ipsum aspernatur eveniet consectetur sed accusantium cupiditate. Labore dolore est id at sapiente voluptates.

Sit placeat et suscipit esse perferendis. Dicta omnis quas possimus eos sed facere et non.

Debitis rerum voluptatem sit. Nulla voluptatem est laborum. Optio dolor aliquam minima aperiam totam error error. Delectus quo est nam sint quia dolores.

At itaque perferendis hic dignissimos atque dolorem recusandae officia. Quo occaecati nulla enim repudiandae veniam corrupti ut. Deleniti vel maiores minima vero dolore earum. Molestias dolor rerum quibusdam ex.

Reprehenderit in dicta consequatur culpa et eius nulla. Molestiae nulla accusamus omnis impedit aut sunt.

Reiciendis voluptas excepturi et quaerat error voluptatem. Eos est id voluptate impedit quo ex eos. Molestiae quia ad sed ipsum ut.","2016-11-30 11:03:53","2016-11-30 11:03:53",239
