first_name,last_name,dob,phone,email_address,remarks,updated_at,created_at,id
Rosemary,Ondricka,2012-06-01,809-408-3383,ankunding.jett@mayert.net,"Voluptates et nihil qui sit alias ullam recusandae voluptas. Distinctio iste et voluptatibus aut velit ipsa nesciunt sint.

Nulla nihil id sed repellendus animi accusamus. Rem repellendus voluptatem excepturi perferendis voluptas iure. Autem et rerum voluptatem reprehenderit rerum incidunt officia.

Est expedita tempora aut quam ullam. Ad sunt officia harum similique. Suscipit deserunt ad nihil autem veritatis a maiores.

Aspernatur reiciendis aspernatur maxime sequi perferendis aut. Neque deserunt repudiandae libero consequatur.

Ea possimus ut aut excepturi eaque minima. Numquam quaerat esse totam voluptatem et dolores animi. Ullam beatae eos nihil quis quos.

Id eligendi quo sint voluptatibus quaerat. Voluptates quam autem reiciendis incidunt natus placeat saepe consequuntur. Voluptatum nulla porro autem maxime rerum labore ullam. Qui ut quis quasi in deserunt dolorem et.","2016-11-30 11:03:54","2016-11-30 11:03:54",259
