first_name,last_name,dob,phone,email_address,remarks,updated_at,created_at,id
Francesca,Koepp,2013-10-25,"1-401-288-0735 x48243",laverna80@yahoo.com,"Alias voluptatem labore ratione ipsum suscipit. Sapiente fugiat reiciendis nesciunt rerum suscipit ullam.

Reprehenderit amet ut accusantium nobis quia deleniti excepturi vero. Quia dolorem beatae quia dolorem aut molestiae deleniti. Labore cumque dicta quia quo est deleniti fugit.

Libero esse error alias ea. Itaque id molestiae doloribus rerum quo fuga odit. Dolorem ut debitis vero sunt reiciendis fugit vero. Sed vel consequatur quia unde.

Ab nisi soluta neque asperiores animi. Ratione ullam quis ratione. Enim repellat autem eum in aliquid cupiditate iure sunt. Non dicta vitae ipsa accusantium hic molestiae molestias. In libero quia consequatur impedit facilis est.

Vitae dignissimos quo dolores illum. Reprehenderit aspernatur adipisci aperiam omnis itaque. Asperiores voluptate quisquam et ipsa eveniet voluptatem. Eum voluptas est maiores animi laudantium et dicta. Quos praesentium odit atque consequatur rerum blanditiis laboriosam.

Doloribus aut ipsum minus nemo. Voluptatum ut rem magni saepe qui aut. Vero ipsa quam esse. Sit quo ut perspiciatis in.","2016-11-30 11:03:54","2016-11-30 11:03:54",270
