first_name,last_name,dob,phone,email_address,remarks,updated_at,created_at,id
Blake,Lowe,1997-10-21,+16822066798,ada.fisher@johns.com,"Tenetur accusamus sunt dolor odit non at. Quaerat et provident hic adipisci. Nemo veniam blanditiis occaecati. Numquam iusto dolores et itaque neque omnis dolore.

Et illo delectus officiis facere quibusdam enim. Magnam et sit sit. Voluptas id ipsam dolore pariatur est. Sunt perferendis perspiciatis accusamus qui ad voluptas debitis.

Maxime qui animi doloribus placeat. Quos dolores nemo nihil. Est suscipit est cumque vero.

Perferendis aut minus fugit placeat nisi. Doloremque consequatur quaerat ut. Fugit consequuntur suscipit adipisci laudantium eaque aut possimus. Mollitia reprehenderit eligendi aliquam unde cumque.

Nemo dolorem accusantium saepe assumenda sit doloremque. Ut eius porro corrupti tenetur animi nisi. Repellendus neque officia corrupti at quis neque.

Qui qui quod cupiditate inventore sed harum ducimus. Alias eum aut magni sit. Corporis vitae et at consequuntur dolorem. Incidunt non qui nostrum.","2016-11-30 11:03:46","2016-11-30 11:03:46",28
