first_name,last_name,dob,phone,email_address,remarks,updated_at,created_at,id
Nikki,Kautzer,1982-08-20,"976-753-5430 x87284",dokon@hotmail.com,"Voluptate rerum error accusantium voluptatibus officiis pariatur laboriosam. Delectus non aut impedit qui quis est ad. Earum et quis quaerat. Ea quae consequatur iusto quod blanditiis impedit omnis.

Officia sint et sit. Praesentium deleniti sed tempore dolor voluptatem et quaerat. Rem non consequatur deleniti qui ipsum tempora in.

Nostrum eos nihil quis magni fugit ipsam velit. Sit harum ducimus aut omnis cupiditate accusantium. Assumenda corrupti assumenda molestias et harum ipsa maxime. Sapiente fugit saepe rerum illum.

Aut deleniti necessitatibus quae quia totam delectus consequatur est. Soluta debitis in voluptas ab voluptatem blanditiis. Ipsa id iste adipisci tempora id.

Architecto impedit mollitia cumque eum. Rerum omnis ab officiis aut fugiat corrupti doloribus beatae. Repellendus consequatur sit suscipit placeat deserunt quia. Iste pariatur maiores magni vero ipsum praesentium dignissimos ipsum.

Non facilis nihil impedit quia iure in. Sunt est distinctio explicabo nisi repellendus aut sint.","2016-11-30 11:03:55","2016-11-30 11:03:55",280
