first_name,last_name,dob,phone,email_address,remarks,updated_at,created_at,id
Ruben,Pouros,1973-01-12,203-733-8705,oran39@smith.com,"Quae in et quo. Magnam omnis similique ut provident et fugiat delectus voluptas. Earum at ut at qui enim distinctio. Amet repudiandae fugiat ab autem non nemo. Sequi fugit amet et non ad.

Nisi quaerat fuga quis excepturi autem dolores. Aut ipsa sint quibusdam ratione tempore praesentium est. Aperiam non nobis voluptas et odit enim. Sapiente eaque vero consequuntur doloribus rem ea corporis.

Officiis non tempore maxime hic quas sed. Saepe in magnam ut nihil. Nam et porro qui voluptates ex at optio. Ea consequatur veritatis mollitia.

Minus doloremque neque nostrum enim labore ipsa ipsum. Accusamus et et quia reprehenderit et.

Possimus consequatur dolore odio placeat maiores non. Autem facere voluptatum accusantium quod non aut beatae. Aspernatur accusamus voluptas ut repellendus.

Adipisci quidem corrupti saepe et rerum est tempore. Est earum itaque voluptatibus commodi ipsum incidunt ipsam possimus. Commodi quos nisi enim et architecto.","2016-11-30 11:03:55","2016-11-30 11:03:55",289
