first_name,last_name,dob,phone,email_address,remarks,updated_at,created_at,id
Adah,Kuhn,1976-10-14,"(619) 900-1424 x35343",mellie.bayer@hotmail.com,"Nisi nobis esse et perspiciatis est quibusdam optio. Est quidem quo sint est qui minus. Provident facilis molestiae ipsa qui modi.

Dolorum vitae eaque occaecati enim. Nulla quod suscipit quasi quam velit. Repellat consequatur doloribus odio ut ipsam at excepturi.

Consequatur dolores et est non qui eius eos aut. Velit dolorum voluptates in blanditiis est. Ad a ipsam sit voluptate perspiciatis dolorum autem.

Amet explicabo quo facilis veritatis consequatur mollitia quia. Consectetur ut ipsum voluptas dolorem suscipit vitae. Quae suscipit veniam deleniti iusto blanditiis. Sint quibusdam odit facere id et quidem.

Repellendus et eaque dolores excepturi. Magni quo fuga voluptatibus et magnam qui. Dolor numquam quas qui esse sed occaecati excepturi. Tenetur autem ut nisi ea. Dolores et nihil ipsam et.

Distinctio facilis nobis est eveniet fuga quis sit ducimus. Magnam dignissimos ad distinctio ullam. Quod qui voluptas modi minus. Dicta eum impedit repellendus officia adipisci inventore.","2016-11-30 11:03:55","2016-11-30 11:03:55",291
