first_name,last_name,dob,phone,email_address,remarks,updated_at,created_at,id
Lenore,Kuhic,1997-09-27,+16957914323,carlo51@yahoo.com,"Tempora quod ducimus velit repellat eveniet vel. Accusamus et tempore similique numquam ut sequi. Repellendus id ad occaecati autem dolorum.

In eveniet esse id delectus aut porro. Eveniet repudiandae quos occaecati consequatur natus voluptatem recusandae. Consequuntur qui dolores sunt est ad nulla nisi.

Nam veritatis consequatur totam. Quidem vitae tenetur corporis voluptas cum. Ut et similique voluptatem inventore numquam harum quam.

Optio aut magni repellat asperiores. Quia veniam qui perferendis illo. Et ab qui nam aspernatur omnis in.

Sunt quia et delectus quis eveniet voluptatem labore. Culpa est recusandae nihil nostrum voluptate ex facilis. Iste odit debitis ipsam id eos perspiciatis.

Magni occaecati sint suscipit modi. Et ratione repellendus libero alias ut beatae dolorem. Debitis aut facere aliquam fuga vel velit aspernatur consequatur. Quia rerum magnam ipsum totam.","2016-11-30 11:03:56","2016-11-30 11:03:56",311
