first_name,last_name,dob,phone,email_address,remarks,updated_at,created_at,id
Brice,Reinger,2012-11-13,583.290.2955,lesch.linda@hotmail.com,"Cum et dicta et qui maxime aut. Consectetur officia ducimus perspiciatis quam nam autem.

Et quibusdam qui officiis quam dolorum dolore sit soluta. Rerum quisquam ut doloribus dolore deleniti suscipit. Voluptates perspiciatis quo nulla facere omnis voluptates excepturi. Quisquam totam voluptatum dolores fugit eligendi voluptatem modi.

Molestiae eum nesciunt eaque fuga at quod. Corporis nemo molestiae necessitatibus earum autem et sed. Veritatis maxime fugiat est consequatur maxime consectetur unde aut. Facere est architecto eos aperiam.

Quibusdam minus assumenda et fugit at nihil libero. Delectus quis autem distinctio facilis. Et ipsa temporibus aut ut nulla sed sit.

Cumque eos nihil ullam non velit illum nihil. Est unde saepe quaerat ut eum eligendi optio. Excepturi sint officiis sed et qui qui et fugiat. Ipsa cupiditate temporibus impedit doloremque aut. Vero nobis nihil voluptas explicabo.

Dignissimos dolores dolorum dolorem amet cupiditate odit aut. Aut pariatur perspiciatis delectus itaque fuga nihil et velit. Assumenda atque pariatur eos in quibusdam. Est eligendi impedit rerum.","2016-11-30 11:03:56","2016-11-30 11:03:56",312
