first_name,last_name,dob,phone,email_address,remarks,updated_at,created_at,id
Art,Nolan,1989-01-07,"(893) 614-5157 x484",vconroy@yahoo.com,"Nihil minus laudantium et. Explicabo accusantium et explicabo eaque. Dolorem cum distinctio omnis. Temporibus omnis magni maxime placeat repudiandae et.

Ipsam fugiat quisquam perspiciatis. Non tenetur consequatur deserunt omnis facilis. Voluptatem praesentium veritatis perspiciatis cumque sit eaque rerum. Eligendi quidem et asperiores aspernatur saepe nulla.

Est quia exercitationem sit eligendi ab ullam. Sed ut libero doloremque id qui. Pariatur aliquid autem aut architecto.

Earum pariatur ut voluptatum eos provident voluptatum. Et assumenda unde recusandae repellat. Consequatur sed quisquam eaque aut beatae perferendis. A doloribus sed vero perferendis aliquid et.

Sed in dicta delectus animi exercitationem expedita voluptas voluptas. Itaque a impedit nobis blanditiis. Ipsam minima molestiae recusandae in. Id laboriosam aspernatur aut eos voluptatem.

Nemo dolor harum laboriosam voluptatum accusantium vel. Quo porro tenetur aperiam sunt sint. Est cumque consectetur quo sunt quas voluptates consequatur alias. Ipsam et explicabo voluptatum non.","2016-11-30 11:03:56","2016-11-30 11:03:56",318
