first_name,last_name,dob,phone,email_address,remarks,updated_at,created_at,id
Julius,Ortiz,2010-03-16,"790.582.1874 x5829",ward.harmony@gmail.com,"Temporibus in sint quo voluptatem tempore eum. Cumque iure et vero quibusdam corporis quae voluptatem laudantium. Rerum eaque et eos labore non. Sunt necessitatibus et ullam ea id. Error aut et sapiente et voluptatem.

Odit atque est pariatur cum rem itaque quam. Debitis dignissimos qui dolorem corrupti et fuga molestias. Rem sint quis perferendis veniam est et.

Aperiam deleniti iure magnam praesentium minima. Quasi fuga qui numquam sunt temporibus. Omnis ab recusandae mollitia atque unde autem. Atque minus assumenda ut est et ullam id.

Reprehenderit iure quam id. Exercitationem eum quaerat aliquid eius aperiam nulla qui debitis. Porro minima atque distinctio inventore voluptas architecto. Impedit non molestiae magnam et qui.

Vero aspernatur earum nam nobis autem voluptatem. Ratione quae at fugiat commodi vel et numquam assumenda. Animi aliquam quod pariatur ea et nesciunt. Recusandae iste est quod qui repellat quia maiores.

Tenetur omnis ut porro ducimus quia vel modi consequatur. Et facere est ut sit qui aut modi. Qui quas non quis aliquid provident aut. Aut architecto et quidem nihil a.","2016-11-30 11:03:57","2016-11-30 11:03:57",334
