first_name,last_name,dob,phone,email_address,remarks,updated_at,created_at,id
Oswaldo,Huel,2002-07-02,"(901) 439-2003 x6888",harber.doris@wilkinson.com,"Est beatae illo voluptatem odio quia. Consequuntur reiciendis ipsa rem illo reiciendis totam nam.

Eos qui inventore natus maxime totam voluptatibus vel sint. Porro ut quaerat sequi fugiat consequatur recusandae. Ab et consectetur facilis quas. Quasi facere illo est impedit aliquam maxime esse necessitatibus.

Veniam labore aut architecto. In quia consequatur amet. Dolore sit facere minus minima repellendus corrupti dolor. Aut at eum in quaerat rerum voluptatem excepturi.

Temporibus consectetur laboriosam voluptas repellat repellendus. Suscipit sed aut ratione odio magni et sunt sit. Similique in aut qui dolores. At iure ipsa et quas.

Vitae sunt qui ut. Et ratione porro et aut dolorem mollitia consequatur. Error corrupti reprehenderit saepe asperiores fuga culpa saepe. Et culpa expedita temporibus excepturi dignissimos voluptatem repellendus necessitatibus.

Dicta et et voluptatem earum est quia praesentium. Explicabo sed tenetur quae assumenda eos rerum magnam. Enim autem reiciendis quae nobis. Nobis consequatur ex molestiae dolores harum et enim.","2016-11-30 11:03:57","2016-11-30 11:03:57",337
