first_name,last_name,dob,phone,email_address,remarks,updated_at,created_at,id
Rylan,Heaney,2004-03-16,"238.323.6039 x53479",darian.homenick@padberg.biz,"Occaecati voluptatum esse cum qui nostrum. Vel facere neque esse cupiditate qui dicta est. Officiis ea consequatur at tempora incidunt reprehenderit.

Iure ratione commodi velit aut quaerat magnam quo. At fuga neque maxime aut dolores. Numquam occaecati quam perferendis numquam sit sapiente. Consequatur et voluptatum inventore esse sed et.

Placeat officia eius veritatis perferendis. Perferendis autem a alias sunt. Aspernatur aut at quia et nam eligendi.

Quod vero dolorem laboriosam laudantium ut. Quibusdam ipsam maxime qui quam aliquam voluptate et. Eligendi doloremque culpa commodi enim nihil dolores.

Maxime et ut assumenda tempore. Consequatur adipisci rerum facilis debitis rem saepe. Debitis et dolorem perspiciatis nesciunt aut consequatur libero. Est esse et facere iste harum libero.

Tempora error sit placeat qui minima placeat. Consequatur suscipit et ipsa voluptatum sit earum. Et nihil et et voluptatem. Sit ipsam enim velit ab quaerat.","2016-11-30 11:03:57","2016-11-30 11:03:57",338
