first_name,last_name,dob,phone,email_address,remarks,updated_at,created_at,id
Blaise,McKenzie,1997-09-06,"882.312.0217 x824",eldridge.ziemann@hotmail.com,"Voluptatem quia quia accusantium ut quod ut ut. Ea magni natus minima quis distinctio laborum quo et. Culpa quia harum beatae eos voluptatum sed veritatis cupiditate.

Molestias sapiente similique voluptatem expedita et in sequi. Autem ipsum consectetur sit fuga sint quia nostrum est. Placeat in fuga eligendi ut facilis quo ut. Aperiam aperiam consequatur et vel velit.

Aperiam quia aut ullam aperiam mollitia totam magni. Repellendus optio sed quod. Quod voluptas consequatur et quidem aut. Blanditiis esse dolorem saepe quia.

Rerum expedita alias eligendi sunt qui aut vitae repudiandae. Ea hic sed minima qui. Molestias et facere ipsum et nulla vel.

Eum occaecati deserunt recusandae minus molestias est aut. Ullam commodi soluta deleniti ducimus.

Autem quibusdam vero doloribus iure nihil. Fugiat praesentium enim aut voluptatem dolore ut.","2016-11-30 11:03:57","2016-11-30 11:03:57",340
