first_name,last_name,dob,phone,email_address,remarks,updated_at,created_at,id
Leatha,McClure,2016-01-08,+1.612.966.3894,considine.shayne@yahoo.com,"Voluptatem natus nemo aperiam iure cupiditate praesentium. Odio ut cumque cum ipsa. Temporibus voluptas et non omnis. Sit ipsum voluptas nemo aliquam quos non.

Vitae vel voluptas rerum quaerat eligendi non delectus. Eaque vitae dicta sunt rem. Aut molestiae sed fugit error recusandae fuga repellat.

Voluptatibus molestiae laboriosam excepturi rem aut nam velit. Id in odio quae qui aut. Vero et accusamus molestias vero sit quam.

Dicta voluptate est aut velit aspernatur ut. Sit animi qui est corporis. Dolores vel eos ad neque fuga quasi autem. Consequatur accusamus laudantium cumque expedita.

Explicabo consequatur possimus praesentium incidunt veritatis. Iusto placeat adipisci et eveniet tempora quasi voluptatem. Dicta quisquam et consequuntur veniam. Explicabo ad aliquid aut laudantium et modi.

Aut cum et quia placeat molestias. Ducimus exercitationem voluptatem cum impedit qui pariatur libero. Sed aspernatur expedita natus explicabo impedit aut reprehenderit. Ut et enim et deleniti eos sed ex. Laboriosam iusto explicabo rerum temporibus vitae cupiditate eligendi.","2016-11-30 11:03:57","2016-11-30 11:03:57",350
