first_name,last_name,dob,phone,email_address,remarks,updated_at,created_at,id
Derek,Mann,1975-05-14,794-419-8205,jamar53@spinka.com,"Sint aut quia doloremque eveniet. Quia aut qui optio sed numquam. Veritatis ullam sit dolorem quos earum qui. Facere in eaque nostrum voluptatem temporibus.

Enim nihil illum veniam hic harum vero. Velit alias at voluptatum assumenda maxime sit.

Aut ut non natus est hic ut suscipit. Laudantium neque iure porro eveniet et cum. Sint et unde magni enim eum. Sed tenetur temporibus magni libero rem.

Tenetur quo nihil quis sint ut quos. Impedit quae dolor aut dolores rerum. Est harum et ut repudiandae. Commodi voluptas pariatur placeat quam.

Impedit et fugiat explicabo ea. Accusantium reiciendis sed deleniti et. Incidunt nesciunt a eveniet omnis temporibus fugit.

Voluptates enim commodi qui doloribus. Impedit itaque vel quaerat.","2016-11-30 11:03:57","2016-11-30 11:03:57",351
