first_name,last_name,dob,phone,email_address,remarks,updated_at,created_at,id
Samanta,Effertz,2015-05-09,895-420-0676,arthur.satterfield@koepp.com,"Minima sit quia eaque maiores reiciendis magnam nobis. Illo nisi eveniet cupiditate et.

Qui adipisci occaecati rem eos. Eaque voluptas vel cupiditate repudiandae est dolores nihil. Modi et atque ab cupiditate nulla sed.

Ratione dignissimos itaque id sed aspernatur. Necessitatibus id necessitatibus asperiores alias. Quo est non velit voluptates cupiditate. Exercitationem expedita neque voluptatum delectus ratione.

Omnis fugit odit est rerum aut odio laborum vel. Aspernatur et rerum libero vel magni provident. Quibusdam eligendi sed qui omnis.

Aperiam saepe minus sit. Esse ullam et cum saepe sed. Magnam nemo quia distinctio voluptate occaecati rerum.

Aut qui explicabo corrupti in omnis modi est. Enim nobis exercitationem quas iusto aut. Pariatur neque eum consectetur quam maxime labore id. Eos sed deserunt deleniti est saepe.","2016-11-30 11:03:57","2016-11-30 11:03:57",352
