first_name,last_name,dob,phone,email_address,remarks,updated_at,created_at,id
Jeanne,Schroeder,1973-12-19,"810-543-8419 x28878",marquardt.kyler@gmail.com,"Aliquid voluptatem odio maxime. Accusantium repellat iusto perferendis excepturi omnis. Sit enim minus sit dolore aut et et nihil. Corporis aut consequatur non.

Id suscipit sint impedit blanditiis illum consequatur adipisci rem. Cum voluptas vel magni neque expedita.

Id molestiae vel est nihil perferendis qui. Recusandae corporis laborum animi minus omnis. Molestias exercitationem suscipit facilis magni officiis odit.

Magni voluptate excepturi fuga ratione eos sequi ex a. Est expedita blanditiis veritatis inventore iure ad. Est eaque ut vel facilis vero illo minima.

Qui itaque maiores et beatae est ut. Eligendi nulla vel aperiam eum nihil. Eligendi consectetur dolor eligendi totam dolor molestiae. Voluptates cum ducimus dignissimos dignissimos eum.

Commodi quod harum facilis pariatur. Velit officia soluta aut. Culpa qui iste autem rerum explicabo molestiae qui qui. Nemo quae velit nisi distinctio est enim.","2016-11-30 11:03:57","2016-11-30 11:03:57",357
