first_name,last_name,dob,phone,email_address,remarks,updated_at,created_at,id
Golden,Schimmel,1976-07-13,"347-208-1383 x13184",zupton@muller.com,"Id corrupti aut qui temporibus. Nulla est distinctio sed excepturi. Non amet cumque sit occaecati omnis eveniet consequatur qui. Pariatur mollitia et aut necessitatibus.

Sapiente et qui eos veritatis dolore. Mollitia consequatur autem necessitatibus sapiente id ipsa velit. Sunt molestias et iure molestiae rem ut. Tenetur et est modi eum cumque aut corporis.

Aut qui autem ex amet repellendus. Eius molestias quo numquam tempora quos deleniti reprehenderit. Quis et sit maiores eaque id aliquid voluptates.

Tenetur harum ut qui eum reiciendis voluptates harum. Laudantium est veritatis dicta et. Qui ipsum et voluptas molestiae possimus inventore. Labore facere tempore fuga perspiciatis eum. Omnis sint laborum quo at et animi nam iste.

Sed officiis accusantium neque. Rerum qui sed eveniet similique quia sed autem. Dolores dolore omnis dolores qui consequatur excepturi hic. Aliquid autem maxime cum.

Et illum recusandae qui velit magni fugiat corporis. In quos et minima consectetur quam sapiente.","2016-11-30 11:03:46","2016-11-30 11:03:46",36
