first_name,last_name,dob,phone,email_address,remarks,updated_at,created_at,id
Delfina,Kohler,1975-03-10,+1-624-525-4904,elubowitz@hotmail.com,"Quasi perspiciatis suscipit dolorem laborum. Numquam quasi praesentium et aspernatur. Libero ut facere voluptatibus atque. Quia eligendi qui eligendi cum officia.

Nisi nisi omnis aut eos debitis ratione. Quia dolores doloribus odio tenetur. Omnis natus sit illum dicta officiis expedita. Animi alias sunt libero nemo sint occaecati.

Veniam ea autem voluptatem sit qui assumenda voluptatum. Illum quo culpa mollitia et. Est quasi incidunt ut.

Omnis ea ducimus ab veritatis. Pariatur rerum quaerat itaque asperiores ut sed. Voluptatibus et soluta perferendis molestiae natus.

Facere vitae minima consectetur cumque doloremque fugiat qui. Omnis non omnis sit.

Qui quod laudantium molestiae distinctio nostrum at veritatis et. Voluptate molestiae nesciunt consectetur. Quae et molestias soluta rerum corrupti voluptatum. Cupiditate dolor neque expedita perferendis nihil perferendis id.","2016-11-30 11:03:57","2016-11-30 11:03:57",362
