first_name,last_name,dob,phone,email_address,remarks,updated_at,created_at,id
Mitchell,Smith,1994-05-28,1-785-718-8691,anastasia.bailey@yahoo.com,"Autem doloremque earum quia voluptas non. Tenetur non ipsa vero laboriosam similique vel et. Voluptatem ullam voluptate omnis consequuntur autem laudantium.

Ab recusandae eum et quo et et et. Maxime nam dolores dolorem dolor et nemo deleniti corrupti. Voluptates eum quibusdam non odit pariatur iure.

Iure illum laboriosam nostrum ex voluptas dignissimos eius. Culpa veniam non accusantium. Dolor vitae commodi corporis.

Est placeat ratione quidem modi magni. Impedit asperiores qui commodi impedit eos. Consequatur nihil ut aut voluptatum perferendis nisi.

Nobis eaque fugiat eos illo illo omnis consequatur. Vero aut harum officia et. Fugit doloremque et facilis aut aliquam natus. Aut est delectus consequuntur placeat magni.

Iure voluptatum et voluptatum dolore eum sint officiis. Id nihil nihil et itaque a. Sed culpa minima omnis. Est officia sed ducimus perferendis magni aut.","2016-11-30 11:03:58","2016-11-30 11:03:58",365
