first_name,last_name,dob,phone,email_address,remarks,updated_at,created_at,id
Vincent,Kassulke,2012-01-14,"(597) 277-2178",fmraz@waelchi.net,"Voluptas in in ad sed voluptatem iure. Eum ratione atque asperiores delectus unde sed nihil earum. Praesentium ut eos ea autem.

Ab pariatur possimus veritatis et fuga voluptates qui. Similique explicabo rerum est a et distinctio. Placeat libero veritatis quia voluptatem quia tempore. Officia deleniti vel enim dolores magnam fugiat voluptatibus. Autem voluptatem laboriosam porro in neque non.

Expedita iste et incidunt facilis ut dignissimos quasi. Culpa aut harum eligendi molestiae rerum exercitationem. Libero ea nihil voluptatem animi ratione non atque. Fuga enim animi et quisquam earum dignissimos.

Ut voluptatem blanditiis culpa autem. Reiciendis ea repellat non sed deleniti voluptas autem maiores. Laudantium laboriosam porro et magni. Sint consequatur sed odit et architecto excepturi consequatur cupiditate.

Sunt culpa est asperiores architecto ut et dolore provident. Est perspiciatis repellendus voluptas. Consectetur sunt at nihil a ea repellendus.

Eius et fuga et cupiditate vel. Dolorem nostrum in provident quas laudantium. Quas in ut aut.","2016-11-30 11:03:58","2016-11-30 11:03:58",367
