first_name,last_name,dob,phone,email_address,remarks,updated_at,created_at,id
Thora,Murphy,1997-02-14,"(574) 468-5097",khegmann@crist.info,"Et quia expedita eligendi quo quia iure quos. Sit eos ut magnam et ratione nisi eius. Voluptas nobis ab nihil dolor. Qui rerum temporibus laborum iure suscipit velit accusamus neque.

Molestiae eius eum blanditiis ut recusandae veritatis. Eveniet tempore consequatur voluptates consequuntur qui praesentium. Ut iusto nobis odit fugiat. Rerum perferendis repellat in error commodi sunt rerum.

Qui nemo delectus mollitia in amet voluptates. Quam ab et nisi ut. Nobis sunt aperiam ut. Doloribus fugit beatae architecto assumenda.

Quae labore repudiandae quod deserunt velit nemo. Vero totam minima rerum suscipit delectus vel. Beatae quo aperiam harum sapiente. Optio officiis aperiam tempore labore officia ipsam quidem omnis. A accusantium id quod quod cum consequatur.

Voluptas voluptas reprehenderit rerum. Voluptatem blanditiis aperiam nam non possimus numquam omnis. Et quia accusantium laborum voluptas et omnis doloribus.

Velit nostrum tenetur asperiores architecto enim. Aut repellat pariatur blanditiis qui sed. Provident omnis odit maiores. Deserunt sapiente fuga delectus illo quaerat animi.","2016-11-30 11:03:58","2016-11-30 11:03:58",369
