first_name,last_name,dob,phone,email_address,remarks,updated_at,created_at,id
Rollin,Maggio,2014-05-11,+1-636-336-3435,jakubowski.bradford@gmail.com,"Dolore perferendis qui quidem nam voluptates inventore. Et recusandae voluptatem rerum officiis.

Et temporibus eaque animi non. Non beatae sint earum magnam id quos. Ipsum voluptatem repudiandae dolores sapiente.

Exercitationem qui modi at occaecati earum molestiae. Voluptates excepturi ut doloribus. Accusamus suscipit expedita expedita quia totam tempora fugiat.

Aut aut minus quaerat aspernatur quos dolor eum. Repudiandae dicta nesciunt in. Et est perspiciatis ab. Dolore cum aspernatur aliquam et.

Maxime asperiores placeat non alias veritatis sint. Aperiam non quis ratione nulla quis aut adipisci incidunt.

Labore consectetur officiis aperiam voluptates iusto voluptatem. Consequatur dolor aliquam sunt quia ullam. Velit dolor eum repellat laudantium dolores quia voluptatem.","2016-11-30 11:03:58","2016-11-30 11:03:58",374
