first_name,last_name,dob,phone,email_address,remarks,updated_at,created_at,id
Meaghan,Kuhic,2009-07-20,"940-688-3956 x8378",pweber@gmail.com,"Quis voluptatibus animi nesciunt natus. Aspernatur est rerum corporis enim magnam ratione. Odio qui laborum velit quo mollitia. Aut at sit veritatis sequi eos dolores illo.

Sunt ut labore pariatur nihil sapiente sequi tempora. Nobis dolores velit maxime fugit delectus deleniti exercitationem. Architecto laudantium et nostrum dolore tempora quia autem. Ratione non debitis doloribus esse suscipit quia. In animi aut aut hic.

Velit perspiciatis necessitatibus magnam officiis corrupti sed illo. Repellendus laborum sint quod et. Quasi ut voluptatem est laboriosam ad nemo. Non mollitia maiores nam itaque saepe eos.

Nobis voluptates iusto molestiae dolore fugiat. Minus id architecto sit nesciunt aut deserunt. Aut adipisci commodi et et modi eos laborum et.

Velit non nam voluptate magni architecto non praesentium. Eos vero velit laboriosam. Itaque voluptatem molestias ut voluptatibus reiciendis. Maiores sapiente accusantium ut ipsa molestiae atque.

Cum eum sunt accusantium quia sapiente impedit distinctio. Enim quasi autem dolores voluptatem error. Qui dolorum iure incidunt sed.","2016-11-30 11:03:58","2016-11-30 11:03:58",375
