first_name,last_name,dob,phone,email_address,remarks,updated_at,created_at,id
Isaac,Jenkins,2007-11-22,1-569-274-9687,elvera.krajcik@gmail.com,"Et vitae voluptatum voluptas reprehenderit. Numquam vero sed molestias tempore laboriosam cumque id ea. Quas sapiente cumque voluptas dolorum.

Accusantium voluptas quidem tempore necessitatibus. Exercitationem vel sint modi perspiciatis aut quam explicabo. Ea possimus pariatur unde non. Inventore non itaque autem at quaerat et commodi.

Reprehenderit ab quod sit eaque. Deserunt praesentium quia ullam. Accusantium quia omnis qui nulla dolor rerum aut.

Ut occaecati aut error. Et quos illo sequi laborum omnis. Quia minus nulla rerum aspernatur excepturi molestiae.

Eligendi vero libero veritatis distinctio labore necessitatibus. Eos veniam voluptates dolorem voluptas ullam eum error est. Quo et at a quia qui aspernatur.

Sed consectetur accusamus cumque et. Ab et perspiciatis esse quisquam. Quasi dolorem dolores et sit aut. Earum omnis occaecati aliquam qui aut. Quidem sint culpa ut id.","2016-11-30 11:03:58","2016-11-30 11:03:58",378
