first_name,last_name,dob,phone,email_address,remarks,updated_at,created_at,id
Domingo,Swaniawski,1987-08-11,"(535) 882-7768",agustina.tromp@yahoo.com,"Tempore enim provident qui autem sequi sit hic. Id provident vel omnis voluptas tempore. Qui quasi quia repudiandae reiciendis.

Sint quia quaerat accusantium assumenda sit facere nisi. Velit sint molestias quia repellat alias. In enim consequuntur ipsam ut. Suscipit id molestiae ut sed eaque porro asperiores quia.

Assumenda atque illum distinctio est nisi architecto commodi. Rem enim numquam quia magnam. Voluptatem nisi et omnis ea nemo deserunt ullam.

Rerum et itaque asperiores non at. Et ex possimus voluptas omnis dolorem perferendis architecto dolore. Eveniet magnam sed quos molestias. Fuga tenetur quo sed sequi tempora et voluptatem.

Alias autem earum a doloribus maxime et explicabo. Nobis deleniti ut laboriosam nulla.

Officiis amet culpa cumque sint. Delectus repudiandae ducimus et adipisci aut cumque aliquam voluptatem. Impedit omnis inventore voluptatem ab.","2016-11-30 11:03:58","2016-11-30 11:03:58",385
