first_name,last_name,dob,phone,email_address,remarks,updated_at,created_at,id
Brody,Reichert,1977-02-28,"404.249.3959 x5504",bcassin@gmail.com,"Perspiciatis ducimus quidem aut. Voluptate vero dolor mollitia quos rem. Non velit accusamus necessitatibus est dolores. Animi provident maiores ut hic vero minima atque.

Ullam commodi accusamus possimus culpa ut molestias voluptatum. Quae ut dolorum dicta beatae rem sint perspiciatis. Praesentium maxime nobis dolor voluptatem reprehenderit. Rerum laudantium et tempore possimus et maiores culpa dolore.

Quia eaque sit voluptatem. Consequatur quas beatae officia nulla quam saepe ullam. Velit et molestias est natus sint doloribus id. Sed sit aspernatur soluta officia. Dignissimos dolorem quam ipsam autem deserunt quasi.

Beatae magnam in libero ipsa error aliquid voluptas. Tempore perspiciatis explicabo nulla beatae aut ut. Qui repellendus mollitia quia.

Placeat sit earum tempore rerum. Quibusdam velit vitae sapiente facere aut. Reprehenderit sequi autem unde rerum.

Distinctio reiciendis quo accusantium autem quam ut. Esse cumque est veniam alias quo. Earum animi natus non pariatur aperiam.","2016-11-30 11:03:58","2016-11-30 11:03:58",388
