first_name,last_name,dob,phone,email_address,remarks,updated_at,created_at,id
Felicia,Kerluke,1972-01-02,"1-716-321-8802 x19118",parisian.keira@leannon.com,"Dolorum quisquam aliquid at voluptatum consequuntur maxime at. Alias qui qui praesentium ut non aut reiciendis. Culpa aut deserunt deleniti placeat ut laborum. Quia unde eligendi exercitationem quae eius.

Quod amet placeat vel et. Eum rem quae distinctio dolorem quo distinctio rerum illo. Et quam sit et soluta et ratione officia.

Aut odit voluptatem rerum laboriosam. Magnam rerum eligendi consectetur nisi enim quisquam doloribus.

Molestiae rerum vel ullam aut. Reprehenderit sed numquam laudantium quos aspernatur impedit inventore. Tenetur natus iusto possimus. Vero quidem quia possimus nam debitis ut et.

Consequatur soluta hic sint ea sed. Et totam qui iusto aut. Ea tempore ut cupiditate sed ea veniam. Veniam possimus corporis voluptas quia aut voluptatum eligendi.

Quasi minus aliquam labore doloribus et repellendus quaerat. Ut earum exercitationem inventore et aperiam iste velit. Hic eaque nihil iure blanditiis.","2016-11-30 11:03:59","2016-11-30 11:03:59",390
