first_name,last_name,dob,phone,email_address,remarks,updated_at,created_at,id
Kathleen,Hyatt,1970-07-04,"521.480.7161 x00429",wellington.frami@yahoo.com,"Autem vel omnis excepturi occaecati. Molestias et optio animi quis. Et sapiente nihil est enim et ad repellat distinctio. Est tempore excepturi repellat maxime.

Reprehenderit sint sint dolor aut fugit quibusdam. Itaque et deleniti assumenda laudantium doloribus atque aut. Vel voluptas ipsam ea est rerum ex blanditiis qui. Vero voluptatum sapiente est quas aliquid praesentium.

Minima quod doloremque distinctio quis est. Ea est eum nemo. Voluptatem tenetur dolorem ut quia repellat non nulla. Illum rerum sit architecto harum voluptates et.

Distinctio nihil perferendis natus molestias. Enim sed est distinctio autem nam consequatur ratione. Sed ut magnam nemo. Dolor ut animi excepturi necessitatibus cum occaecati eum.

Consectetur quo voluptatem ut laboriosam cumque nostrum. Eligendi officia corporis sit non amet eaque ex. Qui eius ut rerum ex adipisci ut repellendus. Praesentium occaecati laudantium dignissimos doloremque perspiciatis.

Harum voluptatem et quisquam ullam voluptas ullam labore. Dolore adipisci veritatis facere et dolores. Voluptatem possimus asperiores qui et sed nihil illo nihil.","2016-11-30 11:03:59","2016-11-30 11:03:59",393
