first_name,last_name,dob,phone,email_address,remarks,updated_at,created_at,id
Leone,Treutel,2014-02-08,+1-982-696-2239,kale.zemlak@hotmail.com,"Nihil qui eveniet doloremque neque impedit aliquid. Quo quis fugiat sunt enim iure. Quas rerum ex aperiam. Nemo necessitatibus placeat veritatis quasi eum velit aperiam.

Facere sed dolore ad explicabo excepturi natus consequatur quo. Soluta eos impedit totam et delectus laborum ut. Voluptas nemo officia fugit enim ab fugit culpa.

Amet et dolores vel cumque asperiores. Expedita vero est qui commodi. Recusandae ex quasi consequatur magnam non fugiat earum. Vitae qui aut asperiores a dolor.

Hic natus quod rerum in maxime repudiandae. Sint occaecati eligendi sit ipsum sed hic. Ut sapiente qui dolor perspiciatis quia suscipit. Id voluptatem dolorem sed voluptatem.

Ut odio debitis aut ipsam quia quo. Ducimus dolorem sed debitis ducimus doloremque veniam. Eveniet quisquam illo modi at cumque. Aliquam fuga mollitia non ut nostrum ex fugit.

Dolorum ratione pariatur voluptas id vel. Nemo reiciendis maxime esse impedit. Modi et id doloribus et.","2016-11-30 11:03:59","2016-11-30 11:03:59",400
