first_name,last_name,dob,phone,email_address,remarks,updated_at,created_at,id
Edmond,Hilll,1979-11-20,+18345825882,yortiz@feest.com,"Culpa reiciendis ducimus rerum suscipit necessitatibus voluptatem quibusdam. Provident ipsam quia minus sunt. Error voluptatum veritatis voluptatem aut voluptatem.

Tempora quia ut rem aliquid dolor sint. Minima qui fuga eum quos consequatur eligendi. Ipsam molestias vitae veritatis aliquid rem temporibus ad. Voluptas et repudiandae veritatis quidem inventore similique quis.

Harum quaerat quae ut aliquam. Dolor et sed quisquam iure quia distinctio. Omnis dignissimos voluptates est perferendis.

Nam assumenda et voluptates maiores ratione et et. Ratione sunt assumenda eum est aut. Cupiditate nemo a odio fuga qui accusantium. Ut tempora fugit nihil aperiam perferendis laudantium.

Maxime impedit deleniti sed tempora eveniet. Non expedita nulla eum ut illum. Aspernatur illo harum est veritatis dolores maiores. Voluptates vel incidunt voluptate minima minima voluptatem.

Ad ad quod eos. Et dolore architecto quod cum. Voluptatibus repellat molestiae vero neque. Sunt impedit eligendi explicabo et.","2016-11-30 11:03:59","2016-11-30 11:03:59",406
