first_name,last_name,dob,phone,email_address,remarks,updated_at,created_at,id
Dewitt,Runolfsdottir,1974-06-26,"+1 (550) 354-8347",marilou77@hotmail.com,"Dolorem sed libero tempore quis et necessitatibus officiis. Dolores est quas qui qui ipsum veritatis voluptas. Qui est rem sint quia. Ut amet numquam itaque tempore sint et consequuntur.

Sunt et nisi vel et sunt cumque. Laborum sed vero quo fugit quidem. Quam ab ea ut praesentium. Nemo omnis quaerat nihil cupiditate natus suscipit nam. Molestiae ut nam sunt fuga corrupti consequatur.

Repudiandae sapiente omnis voluptatem commodi corrupti quis aut recusandae. Incidunt quas velit officiis debitis repellendus et. Accusantium quidem dignissimos saepe.

Dolorem voluptate sequi temporibus doloremque ut magni magnam. Consequuntur inventore cumque quas aut. Illo optio ut fuga quam voluptas et.

Impedit et quos molestiae. Aut alias natus repellat minima. Nostrum sit enim velit aut. Asperiores harum natus dolore aut in voluptatem optio omnis.

Non quo qui modi id qui qui eos. Rerum veritatis assumenda veniam fuga. Alias quibusdam odio laboriosam ipsam non.","2016-11-30 11:03:59","2016-11-30 11:03:59",407
