first_name,last_name,dob,phone,email_address,remarks,updated_at,created_at,id
Elyssa,Hahn,1994-02-15,+1-339-944-6516,dbayer@hotmail.com,"Et voluptatem modi laboriosam mollitia dolorem. Officiis laboriosam aut excepturi dolores. Magnam rem omnis labore a culpa totam est accusantium.

Dolorem culpa aut mollitia hic pariatur quo tenetur. Vero quo et vero illo quaerat nam. Voluptates corporis dolore sint.

Dolore sit reprehenderit voluptatem quia consequatur saepe nihil aliquam. Soluta et voluptatem quisquam ullam. Nostrum et qui eum magni.

Laudantium eos ea assumenda ut dolore quo sint sunt. Ut possimus nemo voluptas est eveniet. Explicabo magni et illum deserunt numquam dolor.

Cupiditate in occaecati aliquam in laborum dolores quia quam. Ad cupiditate qui voluptatem voluptatem qui nam aut. Est in nobis nemo inventore eum voluptates et. Consequatur tenetur quam voluptas ut impedit.

Blanditiis quas totam numquam neque voluptatem. Blanditiis et ducimus voluptas placeat totam omnis aliquam. Quas perspiciatis voluptatum laborum et. Nostrum a earum tenetur animi.","2016-11-30 11:03:59","2016-11-30 11:03:59",413
