first_name,last_name,dob,phone,email_address,remarks,updated_at,created_at,id
Regan,Mann,1980-08-18,"217.264.3095 x69159",jeanie79@hermiston.info,"Facere beatae fugiat vel iure ducimus possimus mollitia. Eos autem quo aut est quo dolore voluptas. Ea dolorem facilis aut sit impedit. Voluptas magnam a tempora nemo quia consequatur id libero.

Delectus repudiandae commodi vitae non. Tempore consequatur dolor quas quo nesciunt exercitationem. Ut modi consequatur cumque a ex.

Fugit soluta blanditiis corporis sed aut non quae. Fugiat ea praesentium quas et ex aliquid. Quos culpa provident quod suscipit.

Rerum sapiente incidunt aut aut nostrum quam ut cupiditate. Porro id voluptatibus aut atque. Quis aspernatur non sapiente aperiam omnis et corporis.

Ut exercitationem accusantium ut. Iste sit dolore eos consequatur. Quisquam eos dolore tempore qui enim in sit. Ut consequatur vero molestias earum blanditiis officiis velit et.

Error temporibus voluptas quos. Possimus non voluptas ut vitae quisquam vitae sequi. Blanditiis accusantium quis ad harum.","2016-11-30 11:03:59","2016-11-30 11:03:59",418
