first_name,last_name,dob,phone,email_address,remarks,updated_at,created_at,id
Mariela,Runte,2004-02-09,"467-781-6386 x256",zleffler@yahoo.com,"Dolorum sunt sunt harum quia. Ipsa magnam cupiditate aut maxime ut facere tempore ipsum. Repellendus quas ducimus voluptatum mollitia repudiandae cupiditate deleniti excepturi.

Quis aut laborum similique. Eveniet nihil nihil voluptatem rerum. Consequatur eos hic voluptatibus.

Facilis repudiandae rerum quis. Autem at perspiciatis qui voluptatem. Repellendus dolorum aut esse ipsam sed. Natus officia eum aut.

Dicta quae nostrum alias. Quis et distinctio a perferendis provident dignissimos. Et ut itaque culpa sit nemo laboriosam. Molestiae autem molestiae deleniti qui.

Et labore id sit cum nostrum autem occaecati ut. Dolores ea animi minima omnis excepturi distinctio fugit aliquid. Vel est possimus laboriosam saepe quae et.

Voluptas id ut voluptatem quam voluptatem quia voluptatem. Aspernatur et quae harum commodi maxime enim expedita voluptatum. Voluptatibus omnis mollitia consequatur aut. Dolores quia officia quos provident voluptatem.","2016-11-30 11:03:46","2016-11-30 11:03:46",43
