first_name,last_name,dob,phone,email_address,remarks,updated_at,created_at,id
Leilani,Bahringer,1992-01-12,+15602298312,tia37@gmail.com,"Qui corporis debitis ab quia quia. Et et et nesciunt quae dolorum ad et. Consequatur fugit quia beatae ut.

Modi harum vitae harum. Nobis alias maxime nostrum. Omnis consectetur aperiam eum eum. Aliquam aut et exercitationem porro fugiat.

Quo tenetur id et animi omnis maxime ut. Ipsa officia debitis hic id. Et earum quia rem quaerat veniam impedit.

Sint est nam commodi ut illo est repellat. Asperiores perspiciatis ea ipsum ullam architecto vel. Rerum a magnam velit et quibusdam et voluptatem et. Quasi et soluta laboriosam voluptas magni. Perferendis magnam excepturi voluptate iste aut eum non repellendus.

Quia adipisci quia expedita praesentium molestias quia incidunt. Ut consequatur numquam aut iusto. Temporibus aut corporis et molestiae eligendi omnis.

Facere unde maxime quaerat quia provident natus. Qui veniam odio veritatis illum. Architecto et tempore ut ut similique non possimus.","2016-11-30 11:04:00","2016-11-30 11:04:00",433
