first_name,last_name,dob,phone,email_address,remarks,updated_at,created_at,id
Lacy,Schmidt,1972-11-19,+1.347.943.1550,schinner.polly@satterfield.biz,"Provident fuga et eum in assumenda eligendi consectetur qui. Et qui corporis id quas error magni. Autem est non ipsa. Iste ut sunt sint dolorum.

Consequatur sint ullam quo. Sit cum consequatur temporibus nobis error labore. Et est esse expedita eveniet sint labore.

Qui nemo tempora ea porro omnis quidem et. Exercitationem assumenda corporis eveniet dolores id nam vel. Nobis nostrum soluta dignissimos optio non et excepturi aut. Consequatur voluptas quasi sint itaque amet architecto.

Earum nisi enim praesentium sit placeat. Minus soluta consequatur voluptas doloremque. Possimus ut quisquam quas itaque maiores. Voluptates blanditiis nobis et in repellendus labore voluptatibus.

Illo sit veniam consequuntur natus vel quia. Voluptatum corrupti consequatur quia voluptate. Possimus ducimus fuga doloribus repudiandae impedit non est. Accusamus non et voluptatem inventore quis.

Et est ut sunt rerum nostrum quae neque. Odit sunt eum mollitia pariatur quibusdam culpa. Blanditiis vitae nemo nostrum. Ut voluptatibus sint voluptatem fugiat a quis debitis perferendis.","2016-11-30 11:04:00","2016-11-30 11:04:00",437
