first_name,last_name,dob,phone,email_address,remarks,updated_at,created_at,id
Verdie,King,2007-02-04,516.813.4452,pdamore@ankunding.com,"Velit temporibus neque non eum in. Et voluptas corrupti eum quia voluptas sit. Et atque eum quam nostrum.

Earum voluptatem similique unde saepe ratione soluta. Omnis unde molestiae aut dolores deserunt quia delectus.

Vel accusamus itaque cupiditate autem doloribus beatae. Similique quibusdam id est et maxime expedita. Corrupti et saepe optio aut corrupti. Laboriosam quas voluptatibus itaque ab dolorem quisquam explicabo.

Nostrum voluptatem sunt voluptatum cumque culpa. Adipisci vitae aut corporis assumenda. Delectus laborum est iure alias dolore est libero sapiente. Quam quidem qui sunt similique est animi.

Animi incidunt est sed necessitatibus. Sit itaque libero ipsum porro rerum. Eum dolore illum laborum ut similique earum. Aut omnis ratione ut quia qui.

Sapiente nobis similique blanditiis illo mollitia. Vitae praesentium nihil et est sequi explicabo dolor. Est eos provident dicta dignissimos et.","2016-11-30 11:04:00","2016-11-30 11:04:00",438
