first_name,last_name,dob,phone,email_address,remarks,updated_at,created_at,id
Nikolas,Weissnat,2003-09-24,+1.828.530.7009,matilde.sipes@schaefer.com,"Laudantium eos natus dicta harum. Sit autem aut architecto ratione blanditiis eaque sequi. Placeat animi debitis consectetur vero et.

At officia distinctio quam velit rerum et molestiae similique. Quisquam soluta nostrum dolor nihil tempora voluptatem. Eaque voluptatem inventore impedit qui possimus voluptatem est. Id illo id minima blanditiis dolor ratione repudiandae.

Aperiam quia esse amet explicabo ab enim. Aliquam incidunt placeat illum aliquam dolorem neque. Repudiandae voluptate ut qui. Deserunt odit aut corrupti autem.

Delectus rerum eum molestias adipisci et sunt aspernatur consequatur. Dolorem voluptas provident aut alias. Ipsam repellat dicta expedita sit. Explicabo repellendus in asperiores explicabo. Cupiditate hic voluptatem voluptatem et nisi.

Assumenda aut tenetur ut accusantium omnis. Deleniti quam non iure aut odit molestiae nostrum. At sit aut facere sit laborum cum. Amet provident velit aut quisquam cupiditate est optio. Voluptatem delectus mollitia doloremque facilis autem ea eaque.

Illo est ut dicta consequatur magnam. Sint excepturi molestiae non ut. Corrupti et rem voluptatem eum explicabo placeat. Molestiae sunt ut voluptatem ut eligendi velit nulla.","2016-11-30 11:03:46","2016-11-30 11:03:46",45
