first_name,last_name,dob,phone,email_address,remarks,updated_at,created_at,id
Marshall,Breitenberg,1993-11-14,879-488-4874,vadams@rau.com,"Et magnam qui velit sapiente error autem. Ullam animi quo tempora ipsam fuga. Molestiae amet magnam suscipit qui eaque exercitationem.

Rerum dolorum necessitatibus tenetur vitae. Doloribus sed hic magnam autem sapiente placeat. Quae corrupti pariatur dolore a. Ipsam corporis quia est deleniti ut laboriosam beatae vel.

Rerum provident sint in culpa occaecati minima. Cumque ut maxime rem ipsam qui nihil similique quidem. Veritatis quia et aperiam ab accusamus consequatur deserunt. Beatae illum labore nesciunt quaerat aut impedit aut aut.

Officia exercitationem quia dolorem alias. Quidem aperiam fuga eum sit ex voluptatem quam. Qui fugiat quia ut quisquam et neque ut labore.

Accusamus perspiciatis voluptas corporis sit reprehenderit perferendis. Deleniti rerum officia quasi ipsa iure non omnis. Mollitia architecto necessitatibus dolore dolore maxime aut culpa.

Maxime est sed omnis mollitia. Iusto qui porro mollitia quas quisquam ut eveniet. Doloremque expedita tenetur autem. Est sapiente praesentium eum voluptates repudiandae repellendus.","2016-11-30 11:04:01","2016-11-30 11:04:01",456
