first_name,last_name,dob,phone,email_address,remarks,updated_at,created_at,id
Lelia,Nienow,1995-04-18,761.349.6686,brakus.gunner@kub.biz,"Doloribus cupiditate laborum officiis similique ipsa adipisci earum. Dignissimos consequatur enim id quam dolorum.

Fugit laborum iusto facilis consequatur laudantium dolores. Qui quisquam suscipit voluptas rem ex.

Est commodi magnam eaque amet ut ut. Placeat quae possimus et ut voluptas. Autem laudantium deleniti a rem nisi. Cum qui exercitationem ducimus dolores.

Dolores omnis perferendis nihil voluptatum reprehenderit atque suscipit. Deleniti sunt doloremque eos exercitationem vero. Iste praesentium nemo vel vel facilis. Iure enim velit voluptatem quam. Aut ipsam veniam veniam necessitatibus corrupti sed doloribus.

Quaerat et dignissimos est fuga. Illo facilis id soluta in. Consectetur consequuntur aspernatur qui cupiditate eius soluta debitis. Est modi consequatur debitis voluptas voluptatibus qui et.

Consectetur expedita ut qui natus est odio et. Dignissimos sint placeat rerum quaerat sit. Cumque repellat soluta quas dicta sit. Atque laudantium hic dolorum explicabo. Aspernatur deserunt sint omnis exercitationem et sit officia.","2016-11-30 11:04:01","2016-11-30 11:04:01",457
