first_name,last_name,dob,phone,email_address,remarks,updated_at,created_at,id
Wilford,Cremin,1977-09-19,"784.635.0497 x8689",evans.dietrich@hotmail.com,"Et debitis nisi in consectetur sapiente. Et molestias alias molestiae nesciunt et quis. Laboriosam fugit aliquam cum voluptatibus veniam. Quia neque quia quo exercitationem.

Culpa rerum voluptates et amet voluptatem rerum. Tempora repellendus quaerat laudantium omnis. Id dolore rerum maiores dolorum qui. Eligendi ratione amet eligendi ullam possimus.

Iure qui consectetur consectetur consequuntur. Nam veritatis reiciendis non dolorem. Dolorem deleniti sit rem suscipit.

Ipsa amet blanditiis exercitationem quas cupiditate est. Expedita quia nobis quibusdam dolorem reprehenderit. Eos animi quis non. Et ipsam dolor autem rerum.

Aspernatur aut et repellendus vero. Necessitatibus itaque voluptatem eum sint dolorem molestias. Quo consequatur voluptatem similique laudantium inventore aut. Ipsa ipsum nemo non voluptatum officia suscipit et. Sed quaerat quisquam est.

Sed velit harum voluptatibus sit sunt. Laborum doloribus est error omnis. Voluptatibus excepturi omnis et ad rerum qui. Unde ab deserunt et veritatis et officia doloremque accusamus.","2016-11-30 11:04:01","2016-11-30 11:04:01",459
