first_name,last_name,dob,phone,email_address,remarks,updated_at,created_at,id
Vergie,Berge,1975-03-13,"1-212-926-5469 x9774",jaylin84@hotmail.com,"Quod assumenda eum veritatis repellendus. Esse placeat nam et quibusdam quaerat. Molestiae voluptas magnam repellat.

Ut perferendis inventore sit tempora repellendus praesentium et quam. Nobis totam exercitationem est dolorum accusamus maiores. Asperiores reprehenderit sunt aut eius.

Sunt soluta dolor incidunt ad et accusamus eos quos. Aperiam esse necessitatibus veritatis aut tempora est cum dolor. Doloremque provident ex autem aut. Labore accusantium eum aperiam veniam laudantium quis facilis voluptatem.

Nostrum mollitia dolorem nulla dolor. Id libero adipisci rem optio perspiciatis aspernatur quas. Eaque quae nemo est ut. At reprehenderit consequatur laudantium et quia eveniet.

Ad dolorum saepe velit excepturi odio repudiandae molestiae. Distinctio consequuntur porro inventore aut maxime sed. Ipsum modi ea explicabo aliquam nisi quia corrupti.

Itaque reiciendis commodi beatae voluptas. Quam reprehenderit iusto saepe deleniti. Accusantium blanditiis unde est est voluptas. Eum quia maxime consequatur et rerum veniam mollitia.","2016-11-30 11:03:46","2016-11-30 11:03:46",46
