first_name,last_name,dob,phone,email_address,remarks,updated_at,created_at,id
Orin,Hahn,1985-10-01,1-246-396-5547,nils.stracke@howell.com,"Provident voluptatem sit facere modi. Repudiandae et quaerat facilis dolore sunt. Enim ab beatae tenetur optio ipsam qui nulla. Tenetur sunt temporibus odit harum quibusdam adipisci id dolores.

Nostrum ex ratione pariatur sed. Voluptate delectus aut et. Est sequi odit eum dolor possimus iste qui.

Facere labore omnis illo odit non et. Impedit atque ipsam in sunt. Accusamus cupiditate unde culpa fugiat. Autem non sed expedita iure.

Animi et ut ut numquam quisquam nulla quasi. Maxime tempore porro fugit a. Enim sit voluptatem vero voluptas. Esse blanditiis illum eos eligendi quidem tempora.

Velit eum harum ipsam aut voluptate sunt. Molestiae porro et facere non eveniet. Quae velit ut asperiores. Delectus qui dolorem ipsa dicta voluptas qui vel. Nemo quasi tempora esse molestiae culpa delectus qui.

Aut soluta libero enim nam. Accusantium nesciunt maiores et est nihil. Repudiandae ut temporibus deserunt possimus non pariatur. Porro eos aut dignissimos qui.","2016-11-30 11:04:01","2016-11-30 11:04:01",462
