first_name,last_name,dob,phone,email_address,remarks,updated_at,created_at,id
Ryann,Leannon,1995-09-21,"1-553-374-1549 x2237",kurtis29@gmail.com,"Delectus voluptate voluptatibus voluptatum numquam et autem. Qui omnis repudiandae ipsam sunt minima consequuntur dolor. Ducimus assumenda dicta earum. Aut nemo at sit debitis placeat impedit. Ipsam saepe sit architecto soluta illum recusandae.

Quaerat perspiciatis earum illum vitae sed deleniti aut. Error sit at quo laboriosam explicabo expedita necessitatibus.

Qui non incidunt qui nam quis quos consectetur. Repellendus et explicabo sit occaecati maxime aspernatur. Quasi veniam est quasi illo laudantium aut est. Debitis sunt dolor molestiae.

Molestiae sit molestiae itaque quos. Officia odit sit sequi modi in aspernatur et. Et ut sequi rem ut eum.

Ipsam non sit ut porro quos qui. Perspiciatis voluptate voluptatem alias enim. Ipsam et necessitatibus aspernatur quia provident non.

Et tenetur vero voluptatem non sunt sed. Totam non hic quam architecto. Ipsam voluptates a veniam soluta nihil distinctio vel.","2016-11-30 11:04:02","2016-11-30 11:04:02",470
