first_name,last_name,dob,phone,email_address,remarks,updated_at,created_at,id
Easton,Prosacco,1994-01-04,"1-592-881-3928 x88729",vsawayn@gmail.com,"Natus ut sed ut sunt. Officia voluptas natus quibusdam. Nam sit necessitatibus illum accusamus qui qui expedita.

Est temporibus dicta velit ipsum tempore ipsam suscipit. Debitis deserunt quisquam veniam aut delectus dolores placeat. Earum qui ut soluta qui aut.

Maxime iure est sed sed eos occaecati delectus. Enim dolores rem vitae voluptatem perspiciatis quis accusamus ut. Nulla reprehenderit ea porro rerum non itaque. Voluptas enim sapiente quia sit soluta assumenda adipisci.

Quia cumque possimus dolores. Deserunt quae ipsum voluptatum sit tempora deserunt. Aut sed occaecati quo quas harum.

Dolorem dolorum velit perspiciatis reprehenderit quia nam. Molestiae ullam eius libero veniam deleniti dignissimos architecto voluptatem. Eum quas repellat quisquam quae consequatur voluptas mollitia.

Quaerat placeat et magni perferendis incidunt accusamus ut. Incidunt aperiam vel voluptatem vel. Voluptas quae dolor atque voluptatum. Exercitationem fuga et a distinctio quo nam dolor laborum.","2016-11-30 11:04:02","2016-11-30 11:04:02",483
