first_name,last_name,dob,phone,email_address,remarks,updated_at,created_at,id
Georgiana,Maggio,1980-02-11,"(574) 573-1267 x76226",audie.grant@oconnell.biz,"Sit laborum aut mollitia vel. Accusamus aspernatur minima consequatur nemo eos sunt. Porro maxime non perferendis. Fuga laborum aspernatur quam animi labore.

Vel animi repellendus ad quisquam sed deserunt rerum exercitationem. Architecto mollitia et dolores dolorem architecto. Eos et iure sed inventore.

Blanditiis dicta eum aspernatur adipisci odit sit perferendis. Eos provident voluptates occaecati qui quas eos et.

Illo velit velit nostrum dolore dolore. Sapiente accusamus alias quo. Quae accusamus qui reiciendis cumque eum id dolorem.

Voluptatibus iste nulla quo quod. Autem voluptas velit quis blanditiis nulla tempora repellendus quam. Explicabo illum temporibus ut dicta quia qui id.

Quo atque vero est necessitatibus id. Expedita explicabo fuga temporibus ut sed similique laboriosam.","2016-11-30 11:04:02","2016-11-30 11:04:02",484
