first_name,last_name,dob,phone,email_address,remarks,updated_at,created_at,id
Yasmine,Pouros,1987-02-26,+1-338-516-4527,gail.ratke@hotmail.com,"Mollitia neque voluptatem voluptas quisquam et qui assumenda. Et ad ut ipsum ratione aut. Voluptatibus quod quia aliquam perspiciatis ipsam.

Rerum occaecati eligendi perferendis doloribus. Earum dolore velit aut ducimus iusto facilis et. Doloremque quis perferendis incidunt dolor aliquam. Minima autem enim ex ut ut.

Quam ut nihil facere. Dolorem cumque sunt asperiores labore aut. Nihil magni sunt et reprehenderit. Asperiores velit qui quis voluptate natus.

Tempore commodi officiis pariatur dolorem. Quis ut accusantium odit enim. Quas quae fuga sapiente natus.

Eum delectus sit beatae illo repudiandae labore. Est accusantium nemo aperiam et unde adipisci alias nemo. Alias nihil veritatis minus. Vero sunt consectetur occaecati.

Enim eveniet nemo perspiciatis unde. Harum expedita aperiam iusto est quod pariatur. Et eligendi alias atque reiciendis itaque earum. Nobis sequi beatae qui.","2016-11-30 11:04:02","2016-11-30 11:04:02",491
