first_name,last_name,dob,phone,email_address,remarks,updated_at,created_at,id
Darrel,Kuphal,1982-08-03,"(980) 733-1077",prudence.jacobson@eichmann.com,"Minus hic nihil nihil veniam aut. Eum quam praesentium dolorem aut vitae suscipit molestias. Dolor iusto doloremque qui nisi et.

Incidunt quaerat ut quae ex. Inventore et est deleniti.

Eligendi provident aliquam qui labore possimus temporibus. Dolorem adipisci excepturi facilis non. Cumque illo eligendi facere aut quis eaque aspernatur.

Et in voluptatem recusandae fugit repellat architecto. Aspernatur omnis doloribus unde ut. Mollitia atque labore id consequatur consequatur beatae ipsam odio. Omnis est consequuntur provident consequuntur nulla architecto doloremque.

Sit ea qui aut impedit at hic. Et ipsam deleniti aut. Et qui enim ipsam qui tenetur error.

Deserunt hic quam molestiae dolores est. Consequuntur laudantium omnis porro rerum dolores id. Molestias labore similique dolor quis. Eos ad tempore sed explicabo eos.","2016-11-30 11:04:02","2016-11-30 11:04:02",494
