first_name,last_name,dob,phone,email_address,remarks,updated_at,created_at,id
Teresa,Pfeffer,2005-02-24,"(775) 839-6964",fletcher54@kassulke.com,"Illum expedita omnis velit facere et consequatur sunt autem. Vel odio et tempore ad architecto voluptas eveniet. Sapiente repellat odio ut et ipsam in sunt. Eos dolores aliquid repudiandae accusamus. Eum aperiam nemo ea odit voluptatem doloremque.

Aut illum iusto cumque a in qui. Quas earum dolor commodi autem. Sint eaque deleniti voluptatem praesentium molestiae voluptatem rerum.

Et odio rerum accusamus et. Nihil provident neque perspiciatis. Reiciendis nihil illum qui assumenda ducimus aspernatur cupiditate. Rerum et error voluptatem.

Libero ipsam eos qui sit est. Sequi consequuntur inventore iusto recusandae. Facere tempore dolorem non autem voluptatibus omnis velit. Aut repellendus et dolorem cumque eum sit.

Corporis id quidem hic molestiae dolorem pariatur. Voluptas est quis magnam praesentium iure reiciendis. Est rerum ipsa non ab quae eius est ipsam.

Nostrum facere cumque sed non reprehenderit dolor. Doloribus doloremque vel perspiciatis magnam est nemo. Sit quam magni accusamus. Dolorem cum perspiciatis corrupti ex tenetur.","2016-11-30 11:04:02","2016-11-30 11:04:02",499
