first_name,last_name,dob,phone,email_address,remarks,updated_at,created_at,id
Franz,Grimes,1994-09-25,"1-245-646-4446 x62518",clotilde.carroll@hotmail.com,"Eligendi est perspiciatis omnis commodi. Sint alias cum repudiandae. Ut amet ipsa sunt similique deleniti. Ad vel sint ipsa officia aut repellat.

Nulla provident assumenda maxime vel porro recusandae. Rerum placeat corrupti voluptate qui. Cupiditate impedit delectus et unde fuga doloribus provident. Culpa ut molestiae veritatis quia soluta exercitationem cupiditate.

Ut et et ab debitis libero saepe veritatis quisquam. Perferendis sint et et sapiente sed delectus velit. Dolor aut maiores placeat magnam. Magni consequuntur nesciunt hic reprehenderit perferendis cum.

Quod quisquam voluptatem molestiae velit quas fugit. Iste inventore voluptas labore harum. Et quibusdam unde commodi error possimus veniam.

Et sunt voluptatem dolore officia enim. Pariatur est aut nobis rem minus aut iusto. Repellendus nisi dolores excepturi doloribus.

Saepe corporis et quam et. Tempora ratione vel natus doloribus minima ut perspiciatis. Ut consequatur et et quos magnam dolor libero sed. Enim porro est eaque officiis nostrum.","2016-11-30 11:03:47","2016-11-30 11:03:47",50
