first_name,last_name,dob,phone,email_address,remarks,updated_at,created_at,id
Isobel,Hoeger,2003-12-30,1-734-987-3602,dkohler@skiles.info,"Ut natus quisquam asperiores autem autem. Et odit et qui sed. Possimus quia error molestiae recusandae quis blanditiis facilis. Earum alias rerum ipsum facilis.

Iure saepe quia vel et sunt in repudiandae. Perspiciatis voluptatem totam ut quia aliquam distinctio eaque.

Et in expedita illum asperiores. Incidunt voluptas eveniet quod aut aut omnis pariatur. Quia quisquam quis est est labore odio quasi.

Voluptas quis autem praesentium voluptas. Sed totam maiores dolores ducimus. Dolores est sit provident fuga suscipit. Inventore perspiciatis esse quas enim aliquid. Non est sequi nisi officia.

Est quisquam reiciendis est praesentium quaerat repellat sed. Velit sequi excepturi similique non sint molestiae tempora. Voluptatem sed quaerat voluptate ut.

Numquam beatae dicta iusto accusantium omnis ut quia a. Molestiae dolores amet consequatur voluptas omnis unde repellat. Vel id perspiciatis et natus in quo fugiat.","2016-11-30 11:04:03","2016-11-30 11:04:03",501
