first_name,last_name,dob,phone,email_address,remarks,updated_at,created_at,id
David,Douglas,1980-06-28,+1.874.828.8126,kasey.keeling@hotmail.com,"Ab quo in consectetur aperiam blanditiis minima asperiores. Dolor ad rem modi expedita officia rem et. Qui error distinctio minima quasi.

Ex fugiat repellendus voluptate eos. Ex soluta dolorum et molestiae totam dolore. Rem sed officia qui qui quisquam sunt magnam velit.

Quo aut quaerat qui autem rerum dolore aliquam. Commodi dolores illum atque repudiandae. Soluta eos sed maxime ab quia quaerat.

Assumenda ut fugiat ducimus provident ducimus fugit veniam. Soluta occaecati fugiat non vel delectus sed. Neque et occaecati deserunt ullam. Quas voluptates qui impedit culpa quidem assumenda qui.

Dolor quo voluptatem nihil atque. Harum corrupti cumque laudantium dolor nihil.

Eligendi corporis autem corrupti totam sequi voluptatibus. Est deserunt nostrum velit soluta porro non. Ex fugit impedit est amet sit expedita veritatis ut. Nulla aliquid blanditiis cumque est suscipit.","2016-11-30 11:03:47","2016-11-30 11:03:47",57
