first_name,last_name,dob,phone,email_address,remarks,updated_at,created_at,id
Alisha,Lindgren,2012-12-08,"739-444-4585 x54404",yasmin.bahringer@yahoo.com,"Accusantium enim quo quia nesciunt. Est est vel provident alias quod dolorem. Aliquam et aut provident et quam ipsum possimus.

Ab repellat nihil et dolorem. Nihil dolorem tenetur commodi omnis ut non molestiae doloribus.

Quas sed voluptatem sint voluptatibus nesciunt tempore qui. Dolores totam velit iste alias eos. Architecto sit aperiam ab officiis aut.

Dignissimos necessitatibus cumque tempora qui incidunt odit corrupti fugiat. Sapiente ea aut odit sit molestias ut beatae. Rerum necessitatibus eos modi sit autem voluptates eum. Ipsum id qui placeat veritatis.

Laudantium minima dolores et est ut. Placeat error autem et omnis officiis. Quia hic asperiores doloremque mollitia sed qui quis cumque. Non cumque ratione recusandae error sequi suscipit accusantium necessitatibus.

Non animi eum aliquam pariatur consequatur cupiditate labore omnis. Quas odio consectetur quo saepe dolorum. Eum odit at facilis explicabo expedita eaque. Cum ut beatae in sunt adipisci est voluptas eos.","2016-11-30 11:03:47","2016-11-30 11:03:47",68
