first_name,last_name,dob,phone,email_address,remarks,updated_at,created_at,id
Leatha,Renner,1987-07-11,1-826-807-9404,dane55@hotmail.com,"Deserunt quas possimus omnis enim. Qui qui molestiae repudiandae eaque autem occaecati cupiditate minus. Et est est atque saepe libero vel. Voluptatem quod autem assumenda non similique.

Cupiditate sint blanditiis reiciendis qui nesciunt ex. Aperiam nulla beatae numquam inventore. Voluptas aliquid corporis velit ea similique in corrupti recusandae.

Enim fuga corrupti tempora expedita fugit magnam quod. Libero illum omnis ut animi animi. Repellendus qui est voluptatem adipisci quod voluptatem.

Maxime et eos a impedit. Provident aut facilis impedit nulla aut. Maxime et voluptate voluptas repudiandae sapiente deserunt nisi.

Nihil eum neque vel earum illo odio. Necessitatibus repellat a et sit eveniet voluptas aut. Sequi voluptatum voluptatem iste velit expedita. Animi maxime molestiae consequatur nihil cum velit dolorem.

Rerum a distinctio consequatur quo cupiditate quasi minima. Vitae dolores facilis consequatur voluptates. Dolor in dolores velit ut.","2016-11-30 11:03:48","2016-11-30 11:03:48",87
