first_name,last_name,dob,phone,email_address,remarks,updated_at,created_at,id
Ricardo,Zulauf,1990-03-31,"1-264-476-8709 x3952",padberg.alan@grady.com,"Dolor maxime itaque sint ut incidunt mollitia nemo. In fuga quidem velit deleniti aliquid. Voluptas doloribus ut explicabo placeat voluptas enim qui. Sint voluptatibus nemo quia illo quis dolorem fugit.

Ad qui nostrum dolorem molestiae maxime quia. Inventore ut voluptas voluptas.

Dolor repellendus aut est. Blanditiis eius recusandae natus est quam quia.

Nam possimus tenetur rem fugiat commodi ducimus. Corporis voluptatem dolorum rerum aut. Quia consequatur voluptatem ratione consequatur nam perferendis est. Et beatae sequi minima et vel quis.

Voluptatem eos facilis quae fuga facilis et. Accusamus rem vel eos eius voluptas pariatur praesentium dolor. A fugit fugiat rerum error similique minima est. Vitae vel id tempore ut qui ducimus.

Suscipit excepturi recusandae at. Fugiat non ipsa officia eum eveniet. Cum ut maxime molestiae aut officiis dolores aperiam.","2016-11-30 11:03:48","2016-11-30 11:03:48",89
