first_name,last_name,dob,phone,email_address,remarks,updated_at,created_at,id
Korbin,Green,1974-07-13,"(227) 351-7571",godfrey20@gmail.com,"Et atque voluptatum delectus et nulla eaque corporis. Est quo sit sit at odit dicta dolorem. Et nihil incidunt a eum cupiditate ea. Est sunt ut sequi rerum dolores.

Voluptatem odio laborum omnis aliquid quidem corporis eligendi. Placeat soluta ipsam aut eos iure. Voluptatem quasi exercitationem omnis rerum deleniti. Culpa accusantium rerum voluptatem ullam voluptatem.

Quia vel aut reiciendis dicta necessitatibus voluptatem quidem. Cumque ipsa explicabo est ad. Fuga placeat sapiente deleniti neque repellat cumque.

Qui dolor eum veritatis ut qui amet. Ut id ut sed voluptas quae culpa qui. Sint impedit veniam et quia delectus voluptas. Corporis consectetur assumenda incidunt repudiandae animi vel nihil.

Eum et inventore at omnis. Et rerum omnis culpa itaque. Non aut voluptatem nam alias enim.

Autem nemo architecto est quis rerum. Qui aut maiores porro id perferendis. Accusamus harum explicabo aut non quisquam.","2016-11-30 11:03:48","2016-11-30 11:03:48",94
