first_name,last_name,dob,phone,email_address,remarks,updated_at,created_at,id
Lamont,Huel,1985-03-02,895.336.0415,pvandervort@yahoo.com,"Occaecati libero maiores laudantium voluptas nesciunt eius sint. Sint accusantium enim sit. Quam amet asperiores ab eum et. Quis ex corrupti ab consequatur in voluptatem eligendi. Maxime quos odit quo amet nihil.

Saepe dolores cum omnis alias cumque autem earum. Quia laborum ex et deserunt debitis qui sed quae. Molestias repellendus perferendis nostrum nostrum odio blanditiis.

Occaecati aliquid provident ab fugiat. Facere expedita et iure dolorem cum. Ipsum necessitatibus natus impedit officia expedita. Veritatis esse aperiam iusto officia qui consequuntur.

Voluptatem et voluptas fugit amet. Quasi et ipsa magnam molestiae odio.

Recusandae illum qui non quia inventore ea. Facilis libero facilis corporis et et quas. Dolorem ex adipisci temporibus fugit laboriosam sed.

Est et amet necessitatibus qui animi eos adipisci. Qui sed reiciendis veniam perferendis in unde libero. Doloribus reprehenderit qui temporibus voluptate repudiandae aut explicabo voluptatem. Nam sint consequatur eius.","2016-11-30 11:03:48","2016-11-30 11:03:48",96
