first_name,last_name,dob,phone,email_address,remarks,updated_at,created_at,id
Merritt,Larson,2010-08-21,"1-953-429-0704 x663",abigale.osinski@bechtelar.com,"Nemo dolore non aut eos. Eaque et omnis aut ad in.

Ex aspernatur dolore impedit sapiente. Officiis ducimus sunt voluptate nemo quos. Vitae sint iste similique ab at. Omnis sunt sed ducimus voluptatem dolores nisi.

Ut accusantium qui magnam placeat est cupiditate consequatur quaerat. Voluptas cum voluptatibus odio tempora. Fuga exercitationem ex accusantium.

Nulla omnis nesciunt voluptatem voluptatibus magnam non omnis ipsam. Provident aspernatur architecto ab. Nihil consequuntur et eaque temporibus maiores doloribus reiciendis optio. Et non fugiat a sapiente dignissimos autem.

Qui eveniet consectetur mollitia vel beatae autem dolorem et. Explicabo quo accusantium alias eos totam. Esse ullam doloremque dolores. Ut fugiat voluptate placeat mollitia quae minus.

Amet asperiores qui quas facilis velit sapiente. Commodi porro ut vitae ut voluptatem a voluptatum.","2016-11-30 11:03:48","2016-11-30 11:03:48",99
